{
  "$schema": "https://json-schema.org/draft/2020-12/schema",
  "title": "read_wine_bot translations",
  "description": "Keys every locales/*.json file must have. Add a key to both properties and required, then to every locale file.",
  "type": "object",
  "properties": {
    "$schema": { "type": "string" },
    "greeting": { "type": "string", "description": "Reply to /start in a private chat, followed by one line per command in the command menu." },
    "command.new": { "type": "string", "description": "Description of /new, which starts a giveaway setup, in Telegram's command menu; starts with an emoji, up to 256 characters." },
    "command.edit": { "type": "string", "description": "Description of /edit, which starts editing the user's giveaway, in Telegram's command menu; starts with an emoji, up to 256 characters." },
    "command.list": { "type": "string", "description": "Description of /list, which lists the user's running giveaways, in Telegram's command menu; starts with an emoji, up to 256 characters." },
    "command.language": { "type": "string", "description": "Description of /language, which shows the language buttons, in Telegram's command menu; starts with an emoji, up to 256 characters." },
    "command.cancel": { "type": "string", "description": "Description of /cancel, which leaves any unfinished step, in Telegram's command menu; starts with an emoji, up to 256 characters." },
    "command.cancelled": { "type": "string", "description": "Reply to /cancel after the bot leaves any unfinished step." },
    "language.prompt": { "type": "string", "description": "Reply to /language, shown above the language buttons." },
    "language.selected": { "type": "string", "description": "Sent after a user taps a language button. %[1]s: the chosen language's button label." },
    "giveaway.prompt": { "type": "string", "description": "First setup step: asks the admin to forward the channel post or send its link." },
    "giveaway.ask_end_date": { "type": "string", "description": "Setup step: asks for the end date; the default, a week from today, is a button." },
    "giveaway.ask_end_time": { "type": "string", "description": "Setup step: asks for the end time in Kyiv time; the default is a button." },
    "giveaway.ask_winners": { "type": "string", "description": "Setup step: asks for the number of winners; the default is a button." },
    "giveaway.ask_button_text": { "type": "string", "description": "Setup step: asks for the join button text; the default is a button." },
    "giveaway.invalid_date": { "type": "string", "description": "Sent when the end date is not a YYYY-MM-DD date." },
    "giveaway.date_in_past": { "type": "string", "description": "Sent when the end date is before today in Kyiv." },
    "giveaway.invalid_time": { "type": "string", "description": "Sent when the end time is not an HH:MM time." },
    "giveaway.time_in_past": { "type": "string", "description": "Sent when the end date and time are not in the future." },
    "giveaway.invalid_winners": { "type": "string", "description": "Sent when the number of winners is not a whole number from 1 to 100." },
    "giveaway.invalid_button_text": { "type": "string", "description": "Sent when the join button text is empty or longer than 64 characters." },
    "giveaway.summary": { "type": "string", "description": "Last setup step, shown above Confirm and Cancel. %[1]s: t.me link to the post, %[2]s: end date and time, %[3]d: winners, %[4]s: join button text." },
    "giveaway.confirm": { "type": "string", "description": "Button under the summary that creates the giveaway." },
    "giveaway.cancel": { "type": "string", "description": "Button under every setup step that discards the setup." },
    "giveaway.cancelled": { "type": "string", "description": "Sent after the admin cancels the setup." },
    "giveaway.outdated": { "type": "string", "description": "Popup when a setup button belongs to a step that has passed." },
    "giveaway.created": { "type": "string", "description": "Sent after the join button is attached and the giveaway is saved." },
    "giveaway.exists": { "type": "string", "description": "Sent when the forwarder's own published or cancelled giveaway is on the forwarded post; points to the edit button." },
    "giveaway.taken": { "type": "string", "description": "Sent when another admin's published or cancelled giveaway is on the forwarded post." },
    "giveaway.not_admin": { "type": "string", "description": "Sent when the forwarder is not an admin of the post's channel." },
    "giveaway.no_rights": { "type": "string", "description": "Sent when the bot cannot edit the post; names the admin right the bot needs." },
    "giveaway.failed": { "type": "string", "description": "Sent when the setup fails for another reason." },
    "giveaway.button": { "type": "string", "description": "Default label of the join button under the channel post." },
    "giveaway.joined": { "type": "string", "description": "Popup after a user taps the join button for the first time." },
    "giveaway.already_joined": { "type": "string", "description": "Popup after a user taps the join button again." },
    "giveaway.join_failed": { "type": "string", "description": "Popup when the tap could not be recorded." },
    "draw.results": { "type": "string", "description": "Header of the results reply to the giveaway post when there are several winners, above the winner links. Plain text: the bot escapes it for HTML." },
    "draw.results_one": { "type": "string", "description": "draw.results for exactly one winner. Plain text." },
    "draw.congrats": { "type": "string", "description": "Last line of the results when there are several winners, after the winner links and a blank line. Plain text: the bot escapes it for HTML." },
    "draw.congrats_one": { "type": "string", "description": "draw.congrats for exactly one winner. Plain text." },
    "draw.no_winners": { "type": "string", "description": "The whole results reply when the giveaway ended without winners. Plain text." },
    "draw.private_prefix": { "type": "string", "description": "Sent to the giveaway's creator before the results when the bot could not post them in the channel. %[1]s: link to the giveaway post. Plain text." },
    "giveaway.ended": { "type": "string", "description": "Popup when the tap comes at or after the giveaway's end time; nothing is recorded." },
    "edit.prompt": { "type": "string", "description": "Asks for the forwarded post, or its link, of the giveaway to edit." },
    "edit.not_found": { "type": "string", "description": "Sent when the forwarded post has no published or cancelled giveaway." },
    "edit.not_yours": { "type": "string", "description": "Sent when the giveaway on the forwarded post was created by another admin." },
    "edit.finished": { "type": "string", "description": "Sent when the giveaway's winners are recorded, so it can no longer change." },
    "edit.not_admin": { "type": "string", "description": "Sent when the creator is no longer an admin of the channel." },
    "edit.no_rights": { "type": "string", "description": "Sent when the bot cannot read the channel's admins or edit the post." },
    "edit.failed": { "type": "string", "description": "Sent when an edit fails for any other reason." },
    "edit.menu": { "type": "string", "description": "The field menu. %[1]s: status line, %[2]s: post link, %[3]s: end time in Kyiv, %[4]d: winners, %[5]s: button text." },
    "edit.status_published": { "type": "string", "description": "Status line of a published giveaway in the field menu." },
    "edit.status_cancelled": { "type": "string", "description": "Status line of a cancelled giveaway in the field menu." },
    "edit.status_draft": { "type": "string", "description": "Status line of an unpublished draft in the field menu." },
    "edit.field_end_date": { "type": "string", "description": "Field menu button that changes the end date." },
    "edit.field_end_time": { "type": "string", "description": "Field menu button that changes the end time." },
    "edit.field_winners": { "type": "string", "description": "Field menu button that changes the winner count." },
    "edit.field_button_text": { "type": "string", "description": "Field menu button that changes the join button text." },
    "edit.cancel_giveaway": { "type": "string", "description": "Field menu button that cancels a published giveaway." },
    "edit.publish_giveaway": { "type": "string", "description": "Field menu button that publishes a cancelled giveaway again." },
    "edit.ask_cancel": { "type": "string", "description": "Asks to confirm cancelling the giveaway." },
    "edit.yes": { "type": "string", "description": "Confirms cancelling the giveaway." },
    "edit.no": { "type": "string", "description": "Declines cancelling or finishing the giveaway." },
    "edit.cancelled": { "type": "string", "description": "Sent after the giveaway is cancelled." },
    "edit.finish_giveaway": { "type": "string", "description": "Field menu button that finishes a published giveaway now." },
    "edit.ask_finish": { "type": "string", "description": "Asks to confirm finishing the giveaway now." },
    "edit.yes_finish": { "type": "string", "description": "Confirms finishing the giveaway now." },
    "edit.finishing": { "type": "string", "description": "Sent after the end time is moved to now; the next winner draw finishes the giveaway." },
    "edit.restored": { "type": "string", "description": "Sent after a cancelled giveaway is published again." },
    "edit.end_passed": { "type": "string", "description": "Sent when a cancelled giveaway cannot be published because its end time has passed." },
    "edit.date_time_in_past": { "type": "string", "description": "Sent when a new end date is today but the giveaway's end time of day has already passed." },
    "edit.stopped": { "type": "string", "description": "Sent when the user stops an edit at the forward step." },
    "edit.list": { "type": "string", "description": "Header of the user's running giveaways." },
    "edit.list_item": { "type": "string", "description": "One giveaway as an HTML line. %[1]s: edit.list_mark_published, edit.list_mark_draft or edit.list_mark_gone, %[2]s: post link, %[3]s: edit link, %[4]s: end time in Kyiv with the edit.list_due, edit.list_draft or edit.list_gone suffix." },
    "edit.list_due": { "type": "string", "description": "Appended to a running giveaway past its end time." },
    "edit.list_draft": { "type": "string", "description": "Appended to the end time of the user's unpublished draft in the list." },
    "edit.list_mark_published": { "type": "string", "description": "Emoji at the start of a published giveaway's line in the list." },
    "edit.list_mark_draft": { "type": "string", "description": "Emoji at the start of an unpublished draft's line in the list." },
    "edit.list_mark_gone": { "type": "string", "description": "Emoji at the start of the line of a running giveaway whose post was deleted." },
    "edit.list_gone": { "type": "string", "description": "Appended to the end time of a running giveaway whose post was deleted." },
    "edit.list_gone_note": { "type": "string", "description": "Note under the list when a post was deleted: participants are kept and the giveaway can move to another post of the channel." },
    "edit.list_empty": { "type": "string", "description": "Sent when the user has no running giveaways." },
    "edit.move_giveaway": { "type": "string", "description": "Button in the field menu that moves the giveaway to another post of its channel." },
    "edit.move_prompt": { "type": "string", "description": "Asks for the post to move the giveaway to." },
    "edit.move_other_channel": { "type": "string", "description": "Sent when the new post is in another channel." },
    "edit.move_same": { "type": "string", "description": "Sent when the new post is the giveaway's current post." },
    "edit.move_taken": { "type": "string", "description": "Sent when the new post already carries a giveaway." },
    "edit.moved": { "type": "string", "description": "Sent after the giveaway moved to another post." },
    "edit.post_gone": { "type": "string", "description": "Sent when the post to put the button on was deleted." }
  },
  "required": ["greeting", "command.new", "command.edit", "command.list", "command.language", "command.cancel", "command.cancelled", "language.prompt", "language.selected", "giveaway.prompt", "giveaway.ask_end_date", "giveaway.ask_end_time", "giveaway.ask_winners", "giveaway.ask_button_text", "giveaway.invalid_date", "giveaway.date_in_past", "giveaway.invalid_time", "giveaway.time_in_past", "giveaway.invalid_winners", "giveaway.invalid_button_text", "giveaway.summary", "giveaway.confirm", "giveaway.cancel", "giveaway.cancelled", "giveaway.outdated", "giveaway.created", "giveaway.exists", "giveaway.taken", "giveaway.not_admin", "giveaway.no_rights", "giveaway.failed", "giveaway.button", "giveaway.joined", "giveaway.already_joined", "giveaway.join_failed", "giveaway.ended", "draw.results", "draw.results_one", "draw.congrats", "draw.congrats_one", "draw.no_winners", "draw.private_prefix", "edit.prompt", "edit.not_found", "edit.not_yours", "edit.finished", "edit.not_admin", "edit.no_rights", "edit.failed", "edit.menu", "edit.status_published", "edit.status_cancelled", "edit.status_draft", "edit.field_end_date", "edit.field_end_time", "edit.field_winners", "edit.field_button_text", "edit.cancel_giveaway", "edit.publish_giveaway", "edit.ask_cancel", "edit.yes", "edit.no", "edit.cancelled", "edit.finish_giveaway", "edit.ask_finish", "edit.yes_finish", "edit.finishing", "edit.restored", "edit.end_passed", "edit.stopped", "edit.date_time_in_past", "edit.list", "edit.list_item", "edit.list_due", "edit.list_draft", "edit.list_mark_published", "edit.list_mark_draft", "edit.list_mark_gone", "edit.list_gone", "edit.list_gone_note", "edit.list_empty", "edit.move_giveaway", "edit.move_prompt", "edit.move_other_channel", "edit.move_same", "edit.move_taken", "edit.moved", "edit.post_gone"],
  "additionalProperties": false
}
