{
  "$schema": "../schema.json",
  "greeting": "Привіт! Я бот каналу @read_wine. Ось що я вмію, ці ж команди є в меню ≡ біля поля вводу:",
  "command.new": "🎁 Новий розіграш",
  "command.edit": "✏️ Змінити розіграш",
  "command.list": "📋 Активні розіграші",
  "command.language": "🌐 Змінити мову",
  "command.cancel": "✖️ Скасувати поточну дію",
  "command.cancelled": "Гаразд, скасовано. Наступну дію оберіть у меню ≡ біля поля вводу.",
  "language.prompt": "Оберіть мову:",
  "language.selected": "Мову обрано: %[1]s",
  "giveaway.prompt": "Починаємо новий розіграш. Перешліть мені пост із каналу, під яким він має бути, або надішліть посилання на нього.",
  "giveaway.ask_end_date": "Коли завершується розіграш? Надішліть дату у форматі РРРР-ММ-ДД, наприклад 2026-10-25, або натисніть кнопку.",
  "giveaway.ask_end_time": "О котрій він завершується за київським часом? Надішліть ГГ:ХХ або натисніть кнопку.",
  "giveaway.ask_winners": "Скільки буде переможців? Надішліть число від 1 до 100 або натисніть кнопку.",
  "giveaway.ask_button_text": "Який текст буде на кнопці участі? Надішліть до 64 символів або натисніть кнопку.",
  "giveaway.invalid_date": "Це не дата у форматі РРРР-ММ-ДД, наприклад 2026-10-25.",
  "giveaway.date_in_past": "Ця дата вже минула. Надішліть сьогоднішню або пізнішу.",
  "giveaway.invalid_time": "Це не час у форматі ГГ:ХХ, наприклад 19:00.",
  "giveaway.time_in_past": "Цей час уже минув. Надішліть пізніший.",
  "giveaway.invalid_winners": "Надішліть ціле число від 1 до 100.",
  "giveaway.invalid_button_text": "Текст кнопки має містити від 1 до 64 символів.",
  "giveaway.summary": "Перевірте розіграш:\n\nПост: %[1]s\nЗавершення: %[2]s (за київським часом)\nПереможців: %[3]d\nКнопка: %[4]s",
  "giveaway.confirm": "✅ Підтвердити",
  "giveaway.cancel": "✖️ Скасувати",
  "giveaway.cancelled": "Створення розіграшу скасовано.",
  "giveaway.outdated": "Ця кнопка вже неактуальна.",
  "giveaway.created": "Готово! Під постом з'явилася кнопка участі.",
  "giveaway.exists": "Під цим постом уже є ваш розіграш. Щоб змінити його, надішліть /edit.",
  "giveaway.taken": "Під цим постом уже є розіграш іншого адміністратора.",
  "giveaway.not_admin": "Розпочати розіграш під постом можуть лише адміністратори каналу.",
  "giveaway.no_rights": "Я не можу змінити цей пост. Зробіть мене адміністратором каналу з правом «Редагування чужих повідомлень» і надішліть /new ще раз.",
  "giveaway.failed": "Щось пішло не так. Надішліть /new і почніть знову.",
  "giveaway.button": "Приймаю участь",
  "giveaway.joined": "Ви берете участь у розіграші!",
  "giveaway.already_joined": "Ви вже берете участь у цьому розіграші.",
  "giveaway.join_failed": "Не вдалося записати вас. Спробуйте ще раз.",
  "giveaway.ended": "Цей розіграш уже завершився.",
  "draw.results": "🎉 Розіграш завершено! Переможці:",
  "draw.results_one": "🎉 Розіграш завершено! Переможець:",
  "draw.congrats": "Вітаємо переможців! 🥳🍷",
  "draw.congrats_one": "Вітаємо переможця! 🥳🍷",
  "draw.no_winners": "Розіграш завершено. Ніхто не взяв участі, тож переможців немає.",
  "draw.private_prefix": "Не вдалося опублікувати результати розіграшу %[1]s у каналі. Ось вони:",
  "edit.prompt": "Перешліть мені пост із каналу, під яким ваш розіграш, або надішліть посилання на нього.",
  "edit.not_found": "Під цим постом немає розіграшу.",
  "edit.not_yours": "Цей розіграш створив інший адміністратор, тож змінити його може лише він.",
  "edit.finished": "Цей розіграш уже завершено, змінити його не можна.",
  "edit.not_admin": "Змінювати розіграш можуть лише адміністратори каналу.",
  "edit.no_rights": "Я не можу змінити цей пост. Зробіть мене адміністратором каналу з правом «Редагування чужих повідомлень» і спробуйте ще раз.",
  "edit.failed": "Щось пішло не так. Спробуйте ще раз.",
  "edit.menu": "%[1]s\n\nПост: %[2]s\nЗавершення: %[3]s (за київським часом)\nПереможців: %[4]d\nКнопка: %[5]s",
  "edit.status_published": "Розіграш триває. Зміни одразу з'являються в ньому.",
  "edit.status_cancelled": "Розіграш скасовано: кнопки під постом немає, учасники збережені.",
  "edit.status_draft": "Це чернетка: кнопки під постом ще немає. Перевірте поля й опублікуйте розіграш.",
  "edit.field_end_date": "📝 Дата",
  "edit.field_end_time": "📝 Час",
  "edit.field_winners": "📝 Переможці",
  "edit.field_button_text": "📝 Текст",
  "edit.cancel_giveaway": "🚫 Скасувати розіграш",
  "edit.publish_giveaway": "✅ Опублікувати розіграш",
  "edit.ask_cancel": "Скасувати розіграш? Кнопка зникне з поста, а учасники збережуться: розіграш можна буде опублікувати знову.",
  "edit.yes": "Так, скасувати",
  "edit.no": "Ні",
  "edit.cancelled": "Розіграш скасовано, кнопку прибрано з поста.",
  "edit.finish_giveaway": "🏁 Завершити зараз",
  "edit.ask_finish": "Завершити розіграш зараз? Протягом хвилини бот обере переможців і опублікує підсумки. Скасувати це не можна.",
  "edit.yes_finish": "Так, завершити",
  "edit.finishing": "Розіграш завершується: підсумки з’являться під постом протягом хвилини.",
  "edit.restored": "Розіграш знову опубліковано, кнопка повернулася під пост.",
  "edit.end_passed": "Час завершення вже минув. Змініть дату або час, а потім опублікуйте розіграш.",
  "edit.date_time_in_past": "На цю дату час завершення вже минув. Спершу змініть час або оберіть пізнішу дату.",
  "edit.stopped": "Зміну розіграшу скасовано.",
  "edit.list": "Ваші активні розіграші:",
  "edit.list_item": "- %[1]s <a href=\"%[2]s\">Пост</a> <a href=\"%[3]s\">[змінити]</a> · до %[4]s",
  "edit.list_due": ", очікує підсумків",
  "edit.list_draft": ", чернетка, не опубліковано",
  "edit.list_mark_published": "🟢",
  "edit.list_mark_draft": "📝",
  "edit.list_mark_gone": "⚠️",
  "edit.list_gone": ", пост видалено",
  "edit.list_gone_note": "⚠️ Пост видалено. Учасники збережені: натисніть [змінити], потім «🔀 Перенести на інший пост» і надішліть новий пост того самого каналу.",
  "edit.list_empty": "У вас немає активних розіграшів.",
  "edit.move_giveaway": "🔀 Перенести на інший пост",
  "edit.move_prompt": "Перешліть мені новий пост із того самого каналу або надішліть посилання на нього. Учасники залишаться в розіграші.",
  "edit.move_other_channel": "Цей пост з іншого каналу. Надішліть пост із каналу розіграшу.",
  "edit.move_same": "Розіграш уже під цим постом.",
  "edit.move_taken": "Під цим постом уже є розіграш. Надішліть інший пост.",
  "edit.moved": "Розіграш тепер під новим постом. Учасників збережено.",
  "edit.post_gone": "Цього поста вже немає. Перенесіть розіграш на інший пост кнопкою «🔀 Перенести на інший пост» у його меню."
}
